post_id,input,input_length,arg_count,avg_gen_length,std_gen_length,min_gen_length,max_gen_length,input_length_quartile,avg_gen_length_quartile,strata
t3_v9xirf,"Rhythm games are pretty easy compared to other game genres So I did actually play a bit of rhythm games in the past (Cytus and a little bit of mania) but I didn't really get hooked. I think it and the genre itself was,,, forgiving and not really challenging (?) since if you want to do good in a certain level, you just have to get used to it, repeat and practice, and that's it. This skill will deliver to other levels because you're already used to it and it will feel easier the time goes on, compared to game genres like FPS, MOBA, RTS, etc where each game is actually different and you have to act accordingly and adjust is much more difficult. I think the only section where rhythm games are actually difficult is reaction time, like speed and execution? But that's primarily it. Also, rhythm games do actually get easier the more experience you have even if you play a different game with different mechanics (as said by my friend who plays rhythm games a lot). But yeah, at some extent, this is kinda true right? I want to be open-minded about this because I recently debated and argued with a certain someone who is good at rhythm games and don't play the same genres I do, and I realized I was being too close minded.",1227,3,948.3333333333334,133.09520402078107,851,1100,Q3,Q2,Q3_Q2
t3_ad6pcy,"Capitalism is Welfare for the Rich 1. Capital is the means of production. 2. Capitalism is private ownership of the means of production. The owners are called Capitalists. 3. Capitalists generate money by only allowing laborers who will give them a portion of the proceeds of their labor to use the capital. 4. In this way, capital generates money for its owner just by being an owner, and not through any productive labor. 5. Capitalists are often richer than other citizens, because they can make money from their labor *and* make money from owning capital. 6. Money generated by ownership is a form of economic entitlement. 7. The ownership of capital is protected by the government (the police, the military, and the legal system), so the money generated by capital is a government-backed economic entitlement. 8. Government-backed economic entitlements are called welfare. 9. Capitalism is welfare for the rich. Corollary: Capitalists are not productive members of society, insofar as they are capitalists. I'm open to the idea that Capitalists might actually provide value to society, but since any actual work capitalists do can usually be delegated to a laborer, I have trouble seeing it. * the CMV moderators.",1218,3,963.6666666666666,174.2880757060945,840,1163,Q3,Q2,Q3_Q2
t3_td2w6r,"Children should not get Baptized or recieve religious teaching until they are old enough to consent. I am an atheist and happily married to a Catholic woman. We have a six months old Daughter and for the first time in our relationship religion is becoming a point of tension between us. My wife wants our daughter be baptized and raised as a Christian. According to her it is good for her to be told this and it helps with building morality furthermore it is part of Western culture. In my view I don't want my daughter to be indoctrinated into any religion. If she makes the conscious decision to join the church when she is old enough to think about it herself that is OK. But I want her to be able to develop her own character first. ---edit---
As this has been brought up multiple times before in the thread I want to address it once. Yes we should have talked about that before. We were aware of each other's views and we agreed that a discussion needs to be happening soon. But we both new we want a child regardless of that decision. And the past times where stressful for everyone so we kept delaying that talk. But it still needs to happen. This is why I ask strangers on the Internet to prepare for that discussion to see every possible argument for and against it.",1275,3,1134.3333333333333,104.14573122952919,1054,1252,Q3,Q3,Q3_Q3
t3_9i608w,"Abortion is a moral as killing a 1 year-old baby no matter what your views of abortion are. I don't know whether I support abortion or not, but to me, it's the same as killing a 1-year old baby. Here's why: they both are useless at that stage in life. They both won't know what's happening. Of course it's different if you torture the baby, but if you kill it quickly and ""painlessly"" then it's the same as abortion. I think once the baby is old enough to have common sense, then it would be different. This is kind of just extra talk to make my post long enough so it won't get removed. This isn't meant to be part of my argument but I guess you can comment on it if you want. I can totally see both sides of this story. When I think about it with emotions, I take the conservative side. When I think about it with logic, I take the Liberal side. I feel like a psychopath though when I take the Liberal side and think that it's ok to kill a 1-year old baby. Then again, there's an overpopulation problem so I begin to take the liberal side again. It's just a back-and-forth. My tendency is liberal though, but it is a bit shaky for some things. Update: My view has been changed. Not a frequent user if this sub so I don't know how you guys typically say this.",1260,3,1042.6666666666667,243.78747575159258,858,1319,Q3,Q3,Q3_Q3
t3_f7osv1,"Government positions should be unpaid I'm speaking from a US perspective, FYI. I think forcing government officials to rely on another source of income would be very beneficial. They wouldn't just be a congressperson or senator, they'd be that *and* and electrician, or that *and* a plumber, or hell that and a CEO I don't really care. Point is their income is elsewhere. 1. (least significant point) It would lower our taxes since the government doesn't have to pay their wages  
2. It would force our lawmakers to work in the industries they affect. Wage laws would affect them too. Social programs, healthcare, etc, would all affect them just as much as they affect us. 3. Reelection no longer becomes a ""do whatever it takes or else you lose your job"" situation. You might lose your position of power sure but you won't lose your income. There's less backstabbing incentive. 4. It's no longer about money. People won't go into office for the paycheck. More people elected into office will truly care about their position and how they can help. Mind you this only applies to government officials (congress, senate, white house, etc), not people employed by the government (NASA employees, public school teachers, etc). There's where I stand, change my view. Where does my logic fall apart, am I missing anything?",1315,3,1057.3333333333333,82.85730706059259,962,1112,Q3,Q3,Q3_Q3
t3_p7wyfb,"Exams should be open book/notes. As an engineering student I find this to be very crucial in learning. Memorizing the material for an exam is not a good way in learning the material whereas having an open book exam makes learning the materials much easier. All exams should be open resources. It increases note taking skills that are actually used in life and the work field and decrease exam stress. It's not fair to automatically assume that all students can retain a mass amount of information. Exams should be applicable based and not a memory test. You retain more information by actually doing research and learning the materials than cramping X amount of information then pouring it out onto a test and forget what you learned as soon as you turn it in. The whole point is to learn the materials, not just memorize information that you will forget. Not everyone can retain information well so by using resources given to you/using outside resources you gain a better understanding/different view of the material which will help you solve a problem that you don't know the answer to. Edit: for anyone wondering, I am studying electrical engineering in robotics and mechatronics.",1184,3,1202.0,34.698703145794944,1172,1240,Q3,Q4,Q3_Q4
t3_7eq78c,"The society is becoming ridiculously sensitive over the subject of gender identity. I am not touching on gender equality here - and just to be clear, to me both genders should be treated in equal way in all ways of life. I feel that the society is becoming increasingly sensitive on subject of gender identification - what gender people identify themselves with. This stems for all the various discussions and programs I see on TV, where some stories seem to me just ridiculous. Let me make one thing clear: if someone is born a man/woman, but feels more like an opposite sex, I can totally understand that. I don't see this as a ""condition"" or illness. They are who they are. Whether they decide to change gender or not, this is their life and entirely up to them. What bugs me is the talk of gender neutrality - how people are neither man or woman. And how there seems to be this movement to enforce the correct language in schools and society, and stop calling people boys/girls, man/woman. I man what the heck? We are a 2 gender species - male and female. There was nothing wrong with this for centuries, why is this becoming an issue now? What am I supposed to call a person I mean without ""fear"" of insulting them.... ""It""? I feel like this is being taken out of proportion, but I could be wrong. Feel free to try and Change My View. * the CMV moderators.",1361,3,1212.3333333333333,216.6133267676145,1045,1457,Q3,Q4,Q3_Q4
t3_ew4z64,"Student loan forgiveness is the hot new way to say $3 trillion bank bailout My view is simple, the biggest benefactor in any loan forgiveness plan is the banks. Money that may or may not be paid back over time are instantly recovered for the banks to be reinvested for their next big scheme. Forgiving student loans helps millions of Americans, lenders have taken advantage of a situation while working with colleges to drive tuition costs up like a rocket. Forgiving the loans currently out, is a short-sighted attempt to activate a base group of voters while simultaneously sucking off their bank friends. What does it do for making college affordable? What does it do for the millions that already paid off their loans or never took any? What does it do for people and families that have had to go without, because of monthly payments? What penalties do the banks face if their lending was predatory? For the record...I did not go to college, I sought professional licenses and I’m doing alright, but I have two children that I want to be able to go to college if they want without spending half their working life paying for their education. My view will be changed if it could be explained how forgiving these few outstanding loans could be for the greater good.",1267,3,1278.0,68.02205524680947,1209,1345,Q3,Q4,Q3_Q4
t3_r661bv,"Now that Google has removed the dislike counter, it is an obligation and responsibility for channels to post their like/dislikes publicly to stay fair and honest. Literally just went to youtube and saw they removed the dislikes, I honestly think its a really dumb decision but that's Google and those idiots went ahead and did it. Basically my view is that the change doesn't matter because all the channels can post and pin a comment saying the like to dislike ratio, or something like that. I just feel now that dislikes are effectively gone creators are just gonna make trash videos and not care about the reaction or take really shady sponsorships, etc. It doesn't really remove constructive feedback that a channel can experience through comments or what not, but it removes the at a glance view of whether a video is good or not. **My opinion is that if a channel does not post their like/dislike numbers anyone is reasonable to assume they do not care about the content that they put on their channel and are not worth watching. **
I especially hold this view for the channels that made video after video about this youtube change. If those guys are too lazy to post their dislikes after making a fuss about it then those guys are **hypocrites. ** Anyone can literally do it, it takes a few clicks and copy/paste, hell you can even make a script for it! Alright that's my post, would like some feedback thanks! &amp;#x200B;
A user made me aware that there is an add on to see dislikes  here it is, obviously its not a reddit link so be aware.",1549,3,853.0,46.604720790924176,801,891,Q4,Q1,Q4_Q1
t3_9rzmej,"It's impractical to use ""Innocent until proven Guilty"" approach to non-legal, everyday settings. I have been inspired by people saying that we should be using the ""Innocent until proven Guilty"", not only in a strictly legal settings, but as a way of life. While this is definitely the most fair, I fail to see how practical it is. Starting off, nearly 100% of our interpersonal decisions are made from links of trust, not proof. If two different people tell me a different story, and one of the two people were someone I knew, I would trust my friend over the stranger. When there is no proof, and the only things left are two personal accounts, I would trust my friend who I would know of their character. Now, I am not saying that my friend is always right, or that it is rational to only trust someone who you personally know. I am saying it is impractical to NOT believe your friend on the account that there is no evidence. Let's pretend that I was a boss. Two people are held for an interview. One person is rumored to have a terrible personality. The other person isn't talked about. Given similar specs, I would hire the person without those rumors. Is it possible that they were false rumors? Of course. But I don't care about justice. It is more convenient for me to just choose someone without those circumstances regardless of the truth. There is no point in me sorting through their drama when there is a much easier alternative. To me, most people live their lives under the assumptions that our acquaintances would not lie to us. And that makes sense. If you think otherwise, please CMV
* the CMV moderators.",1623,3,787.0,38.43175770115127,744,818,Q4,Q1,Q4_Q1
t3_9syrun,"I would be a hypocrite to vote for Keith Ellison as Attorney General. I live in Minnesota. I’m a liberal and believe very strongly in social progressiveness and especially in undoing literally all socially conservative policies. So I am truly in a conundrum here about how I ought to vote in the Attorney General race in Minnesota. The Republican candidate, Doug Wardlow, would be very happy to create laws against gays and against women which I find abhorrent. But on the other hand, you’ve got Keith Ellison and the accusations against him by his ex-girlfriend as clear evidence that he is yet another man using the power of his gender against the weak, for whatever benefit he thinks is best. More importantly, since the start of the Me Too movement, I have made a point of saying that despicable people need to have their power stripped from them, no matter what policies they support. The government is still led by people, and those people need to be our very best. Being abusive to your girlfriend is more than enough for me to write off a person as a scumbag. I was also 100% in favor of Al Franken’s fall and was from the start. I have to stand by my principles. That being said, the Republican candidate would do actual damage to millions of people in my state if he actually got his way, promoting policies against gays and against reproductive rights, especially birth control which is just common sense at this point. It’s far worse for my state if Doug Wardlow won. But still...how do you vote for a guy that abuses his girlfriend?",1545,3,799.6666666666666,22.030282189144398,785,825,Q4,Q1,Q4_Q1
t3_xaj11z,"Good friendships and romantic relationships will inevitably burn out like a candle This view is making me sad. Since recently I have a friend who I'm really close with, first time in my life that I'm so close with someone. She has given me something I never had. Warmth, affection, someone laughing at my stupid jokes, someone actually giving a shit about me. And then ofc my stupid brain must find some way to make it seem bad. Well it chose to go with  
 ""you will lose her eventually because the lifespan of a friendship is limited. Yes you will perhaps remain friends after this lifespan but it won't be on the same level as it used to be, it will become boring, you will care less about them than now, you care now because it is new to you and because you want to discover them, learn about them, but eventually that will be over. Eventually you will know basically everything about them, you'll have asked every question you'll know every story and you'll be able to predict their answers before they even say it, and that will annoy you, because that will make things boring with them. Sure there are other things to talk about, maybe politics or exchange ideas, that's cool but not on the same level. You used to have friends to talk to about ideas, that was fun, but in no way was it a close friendship. The moment they disappeared they were not forgotten but there was no real longing to see them either."" So now whenever we text and have a convo going it's a mixed feeling because one side really likes the talking with them but then another voice is whispering that by talking to them it brings me one step closer to knowing all about them and being closer to the 'boring phase', just like a bright candle burns faster than a dim candle I suppose. I strongly wish to cmv...",1785,3,839.6666666666666,60.5419964432404,775,895,Q4,Q1,Q4_Q1
t3_umdvo0,"Kathy Griffin should have been banned from Twitter I was having an argument with somebody close to me that is extremely conservative, and we began talking about conservatives being banned from Twitter. I am all for people being banned for misinformation and fomenting violence. I am glad Trump got banned, same with Steve Bannon's crazy ass calling for people to be beheaded. I brought up these points and they retorted by mentioning that Kathy Griffin was not banned for similar violations. I shot back that she got fired from CNN's New years show with Anderson Cooper, and her tweets were flagged, but I am not sure if that was enough. Holding trump's severed head and then going on to suggest that Trump should inject himself with a syringe with nothing but hot air, which could kill him, seems like it's inciting violence to me. It is basically saying, I want this person to die, which may encourage nutters to make it happen. As much as I wanted to retort with claims of whataboutism, something in me kept thinking that she really did get a pass. And that even though the right loves whataboutism and loves to complain about liberal bias even when there is none, I suspect that this really was a case of bias and a double standard. And I know that twitter is entitled to have double standards, they are a private company and they can do whatever they want, but I think they should have a level of consistency. Ban those right wing nutters when they post violent stuff, but the same should go for a liberal like Kathy Griffin as well.",1538,3,947.0,90.33825324855468,888,1051,Q4,Q2,Q4_Q2
t3_e4ih37,"Bank safety for personal checking accounts is excessive in Europe Because of work, I have lived in a number of European countries where I opened bank accounts for salary deposits, personal expenses, bank transfers, etc. In addition, I have always had one or more bank accounts in Canada where I have my permanent residence. My biggest shock with European banks is how complicated it can be to open a bank account and the number of safety features the banks impose on account holders. * In Canada, you can open a bank account online without requiring any human assistance. You only require a social security number and must declare that you live in Canada. The bank card is received by mail and the PIN is chosen by the account holder over the phone. * In the UK, you must come in person to the branch and there, present an ID and a proof of address. You later receive the bank card and PIN by mail. * In Switzerland, same as the UK, but you must use a home card reader to access online banking services using your PIN to unlock your account. * In France, same as UK, but you must pick-up the card in person at the bank. A verification by SMS is required for online transactions and bank transfers. * In Czech Republic, same as France, but the PIN is sent by SMS and is encoded. You must decode the PIN number yourself using a key provided by the bank (which, of course, you must pick-up in person). To access online banking, the bank will install on your computer a digital certificate. I don't understand why all these features (proof of address, SMS validation, bank card pick-up, digital certificate) are necessary when other countries like Canada don't use them. I must also point out that the Canadian banking system is being one of the safest in the world and that frauds are not common to my knowledge. I can only conclude the safety European banks is overkill which makes the banks themselves rather inefficient and bureaucratic.",1937,3,935.6666666666666,67.71508940652248,887,1013,Q4,Q2,Q4_Q2
t3_7e3m1l,"I think people who have children while on welfare should lose all benefits. Seriously, I can't support this current system of welfare. The more children you have, the more money you get from the government. Screw that, if you can't support yourself you shouldn't be having children, especially if you make me pay for it. NOTE: I am not against welfare, just the way it's implemented. The apartment where I currently live has basically been bribed by the government to rent out tons of its rooms to homeless, and almost every women among them has at least two children at their feet at all times and are pregnant. It is my belief that welfare recipients should receive free birth control and condoms and that they can enter welfare while pregnant and while they have children. However if they become pregnant while on welfare they are either taken off welfare altogether or they must have an abortion. UPDATE: Ok, view changed 30 degrees by Feathering. My modified view is that having kids on welfare won't mean it is revoked from you but it won't raise whatsoever. So every kid will stretch the budget thinner, thus motivation to stop having more children. UPDATE: I am now pro required birth control for anyone on welfare with a 1 strike policy. If they have a child while on welfare and not get it aborted, if they still want welfare they need to voluntarily be TEMPORARILY sterilized(IE a procedure that can be undone after they no longer draw from welfare). So not punishing the children, only the adults. UPDATE: View Changed. Thank You for all of your comments. I am really glad you took the effort to convince me otherwise of my view, which even disgusted me a bit. This sub is awesome. * the CMV moderators.",1715,3,1079.0,41.94043395102154,1041,1124,Q4,Q3,Q4_Q3
t3_q3dmmn,"I'm not a fan of euthanasia More specifically I'm talking about voluntary euthanasia or physician-assisted suicide. There is no way to be sure patient is committing assisted suicide of their own free will. With 'normal' suicide person's will manifests through physical actions  that they take to kill themselves. If a patient is incapable of performing these physical steps there is no way to be certain they actually mean it. We've all said once in our lives that we want to end it but haven't actually done it. Same logic should apply to terminally ill patients. Even if they say they want to commit suicide, it doesn't mean they would actually do it if they were physically capable. So we shouldn't help them achieve it. In cases where a person is physically capable of committing suicide on their own we should never help them. I don't think it's controversial. But what if a person can only move one finger? They can push a button that delivers lethal overdose but can't do much else. I'd argue even in these cases physicians should not provide patients with means to overdose. Pressing a button is just too easy; it removes natural barriers that prevent us from hurting ourselves. For example, this theoretical patient would press the overdose button but would not hang themselves or otherwise actively kill themselves. Providing a patient with an easy way of killing themselves is intrinsically coercive and coercing people into committing suicide is generally considered bad. *Disclaimer:* There are many good arguments for and against euthanasia. I'm interested in issues with my specific argument about free will. I also don't care much about legal status of euthanasia.",1680,3,1118.6666666666667,53.57549190939207,1081,1180,Q4,Q3,Q4_Q3
