post_id,input,input_length,arg_count,avg_gen_length,std_gen_length,min_gen_length,max_gen_length,input_length_quartile,avg_gen_length_quartile,strata
t3_7t9ou8,"EBITDA is a misleading and overused indicator, because it hides the bottom line. EBITDA is a misleading indicator, because it hides the bottom line. When comparing a company to another, or even when assessing a given company, I want to know what their very bottom line is. EBITDA is not telling me the whole story. Any taxes that the company has will still need to be paid, and therefore what shareholders get at the end is what should matter more than EBIDTA. However most people continue to use EBITDA as the holy grail instead of using net income, ROI, ROE or other more important indicators. Edit",600,3,831.3333333333334,84.87834431310105,769,928,Q1,Q1,Q1_Q1
t3_8tvru0,"Drug addiction is a choice, not a disease I do have sympathy for those with drug addiction, but they did originally make the choice to put the drugs into there body. No one held them down and injected them with heroin. I understand that after that they can\`t fully control there needs, but it was there fault for doing the drugs in the first place. I try to have empathy for others whenever I can, but I find it difficult to do so for addicts when they are the architects of there own destruction. I would love to hear others viewpoints and experiences to better understand this complicated issue.",598,3,873.0,97.24710792614863,766,956,Q1,Q1,Q1_Q1
t3_87lj0c,"I don't want physics to advance any further. Firstly, I have a scientific background in genetics, so, 50% of me is totally against this statements, BUT
I see science of physics, especially quantum physics as a base for everything. And here I see the problem - if we figure out this utopian 'formula for everything', it does not make sense to investigate anything any further, because You can just holistically calculate anything - conditions in any possible planet, future path of every human, every event in the future. It just doesn't make sense to do something, because You can do anything and know what will happen even without doing it. Maybe this is impossible, but maybe major breakthrough that will allow it is just around the corner and now is the time to not let it happen, because it will kill curiosity.",815,3,915.0,56.50663677834667,872,979,Q1,Q2,Q1_Q2
t3_6d2s8x,"expensive headphones are not worth the price in relation to cheap ones. I use headphones and earphones quite a lot. I always bought the cheap ones, and they used to break every 4 months or so. Although I bought some 20$-ish Sony headphones for quite cheap 2.5 yrs ago and they're completely fine to this day. From a /r/AskReddit post, I've heard some really positive opinions about expensive headphones, but I still don't feel like I'm convinced. I'd want you guys to try and convince me that the expensive ones are worth buying. Money isn't really an issue, talk more about sound quality, comfort and durability. Thanks and may we have a nice debate.",651,3,1008.0,195.84687896415403,842,1224,Q1,Q2,Q1_Q2
t3_178tnlv,"EVERYTHING is subjective Literally everything is subjective, or subject to interpretation. Please CMV by naming something that is objective. For example, some may think 1+1=2 is objective, but this is only true in Base 10 math. In Base 2 math, 1+1=10, therefore making the first statement subjective. Another example, ""we've never stepped foot on Mars"" - who's we? How do you know, and can you prove it? (ik this sounds dumb) but what is *proving* this statement to be objective? A general consensus? Well that is sub-mf-jective. I understand that this creates a conundrum, and some may argue that me stating ""everything is subjective"" is an objective statement in and of itself. I don't disagree; I am very open to someone C'ing MV. Life's odd, and there's no definitive answer to anything. Is there?",801,3,977.3333333333334,220.08256026621768,793,1221,Q1,Q2,Q1_Q2
t3_93s0r0,"boneless wings are just chicken nuggets. chickens have bones in their wings so therefore chicken wings should be served with the bones still intact. chicken nuggets are just clumps of chicken, without bones, and are not classified as wings. boneless wings are just chicken nuggets, in all senses. boneless wings are referred to as boneless wings so adults will be more open to eating chicken nuggets. chicken nuggets are seen as a childish meal so boneless wings are essentially a term used to trick individuals into purchasing overpriced chicken nuggets.",555,3,1145.3333333333333,113.0014749166281,1042,1266,Q1,Q3,Q1_Q3
t3_665gz3,"""Hangry"" is not a thing, people that say ""hangry"" are just using that to excuse being assholes. I hear people (well used to hear) say this all the time, and it was always used to excuse bad behavior. There are lots of things in everyone's life that are less that perfect. Being a first world denizen that got hungry does not excuse acting like an ass or lower the bar for acceptable behavior. Either you can act like an adult or you cannot, the fact that you're an hour or two late for a meal does not make it acceptable to become rude, abrasive or generally shitty to other people. There's no such thing as ""hangry"" you're just hungry and using that as an excuse to be an asshole: CMV
Edit:
I worded this poorly, ""hangry"" is a thing. What I meant was ""Being ""hangry"" does not give people a free pass to be assholes. One's blood sugar being low doesn't make it OK to be an asshole.",881,3,1178.0,187.14432932899678,1045,1392,Q1,Q3,Q1_Q3
t3_22f1kj,"I strongly feel that scientists especially Physicists should be allowed to patent their theories It says here that scientific theories cannot be patented. Scientific theories are not discoveries. There is no way of 100% confirming whether a theory is true or false. Only ways of confirming it. For example the Law of conservation of mass-energy can be verified so many times, but it cannot be proven as true for all cases. Also there are cases where naturally occuring DNA sequences have been patented. I feel that when Apple can patent something as trivial as curved edges for their phone, Scientists should be allowed to patent and get royalties for thinking the way no one has never thought before.",701,3,1113.6666666666667,138.9544289806314,1012,1272,Q1,Q3,Q1_Q3
t3_xs6lnj,"If there were no animal protection laws, most mammal species would be extinct in the U.S.. Given the amount of guns in the U.S. and the lack of things to legally shoot and kill, I believe if we did away with laws preventing shooting animals in residential/urban areas, and hunting at certain times and only certain animals, deer would be extinct, rabbits would be extinct, foxes would be extinct, etc. If there were no laws to prevent shooting your gun in an urban, suburban, or rural area, people wouldn't just shoot anything, though. Shooting other people's property would have repercussions. But with no law to prevent shooting as many bears as you want, whenever you want, for example, people would hunt them to extinction in the U.S.",738,3,1489.3333333333333,63.00264544710271,1450,1562,Q1,Q4,Q1_Q4
t3_8det7m,"People who order Decaf Black Coffee either hate themselves, or have no sense of taste Now I work at a place where I am the cashier and also get to make drinks for any orders that involve them, and lots of the time I get orders for Black Coffee, which is okay by me, I get that some people only order Coffee to wake up and they believe that Black Coffee is the most potent, I also know that some people don't put anything in the coffee in fear of calories as well, so that's okay if you would like to wake up. Now here is my argument, Decaf Coffee is.. Well... Not designed to wake you up... So.. What is even the point of ordering it Black? It tastes horrid, and drinking it is torture in my books. And if you're about to tell me that they put cream and sugar in it later on, I see them drinking it right away
So can someone please explain to me what the point is? Maybe I'm missing something.",893,3,1242.3333333333333,43.131581623368874,1206,1290,Q1,Q4,Q1_Q4
t3_p68364,"While I believe systemic racism is real, I don't believe it is a big factor that determines an individual's success in life. I think this comes down to values and culture far more. I found this link the other day and was blown away:   
Check out how well the Asians are doing. I think that if systemic racism were a big factor, than Caucasians would be at the top of the list, and everyone else would be far below. This list of household incomes by ethnicity proves that systemic racism is not as big a deal as it is made out to be by the media.",545,3,1357.6666666666667,24.704925284917067,1335,1384,Q1,Q4,Q1_Q4
t3_rht8jf,"It is not better to have loved and lost than never to have loved at all. A famous quote by Alfred Lord Tennyson goes: 'Tis better to have loved and lost than never to have loved at all. I disagree. As someone who has loved and lost someone to death, I can say that the pain of the loss is absolutely horrible. It seems to me if you have never loved, you would not know the pain and loneliness such loss brings. The emptiness and  despair I felt after burying my wife of thirty four years was indescribable. And now, even though I was blessed enough to find love a second time in my advancing years simply highlights the emptiness I felt when I was alone. I have seen many cases of people who die a short time after the loss of their spouse. Some commit suicide, others, like my father, seem to simply wither away in despair. I was lucky after my wife died, I found a good woman who was as hungry for love as myself. I am happy now. But to many people the loss of a true love is a pain that never ends. So tell me I'm wrong, you can't miss something you never had.",1063,3,801.6666666666666,102.75375094532234,735,920,Q2,Q1,Q2_Q1
t3_7oml7s,"People who allow their partner to abuse their children should themselves be charged with abuse, even if they don't ever directly nparticipate in the abuse If you let your kid play on the interstate regularly, for years on end, you'd absolutely be seen as negligent or at fault when the kid gets hurt. Maybe in those cases you hear about, where for example a man is sexually abusing a child over a long period, and the child comes to the mom for help and the mom denies it could possibly be happening, maybe knowing that the mom could get in trouble for sexual abuse of a child themselves might prompt her to do something instead of just deciding to be in denial. There are some cases, of course, where for example the wife herself is so terrorized, or is basically being held prisoner by the husband by whatever means, that it would be almost impossible for her to escape, but the courts could decide whether that was going on for each case. Of course I still think if the non-abusive caregiver has been clearly complacent and indifferent, they should be punished, but in those cases they probably usually are. * the CMV moderators.",1132,3,873.3333333333334,75.96271015000275,827,961,Q2,Q1,Q2_Q1
t3_pn206x,"The United States Should Have Mandated Military Service as a Disincentive for War This is a belief I have quietly held for awhile, so might as well post in here. I believe that the United States is more willing to go to war than we should be (Iraq and Afghanistan). I believe that Congress would be less willing to vote in favor of war if all American families had to worry about their kids dying overseas for shoddy reasons. Change My View. One note before we start, I will not be convinced by arguments that the US is correct in their war making decisions. That is not an argument that will change my view. I have no desire to get into a pointless debate on that topic that will change neither of our minds. My CMV is directly related to whether or not it is worthwhile to mandate military service in exchange for a decline in our willingness to warmonger. Edit: Sorry if I am slow to respond to newer comments. My view has been changed and I will try to get through comments eventually to award deltas where applicable! Thank you for your time and responses!",1061,3,968.6666666666666,61.272614872660164,911,1033,Q2,Q2,Q2_Q2
t3_wfn1d0,"Reddit would be better without the option to downvote I understand the point of karma, but I think it could be achieved with just the option to upvote a comment/post. With just upvoting, people could still display on their profiles that people like what they have to say (through their karma). I don’t think there is a use for downvoting, and in my mind it gets in the way of freedom of speech. People who believe something that they know is an unpopular opinion might not say it if they’re worried their karma will be ruined. I don’t think Reddit should discourage freedom of expression. Reddit should be a place where everyone feels welcome to express their views (civilly) that leads to respectful debates and discussions. The only argument I can see towards downvoting is if a post or comment is hateful/offensive. In that case, a mod will just take it down. Therefore, there isn’t a good use for downvoting.",912,3,934.6666666666666,134.00124377532222,835,1087,Q2,Q2,Q2_Q2
t3_16ftgx7,"I Don't Benefit from my House Appreciating in Value Last month, my wife and I bought a condo in downtown Toronto - all cash, no mortgage. People talk to me as if it's good that the condo will appreciate over time. But how? This is our permanent home, and I plan to stay here till I die. At age 41, I've never had any debt - not even a credit card, and don't ever plan to. I'm vehemently ""anti-debt"" (only for myself, no judgment on others) and I will die without ever taking a loan. If anything, an increase in value will increase my property taxes - a bad thing! From my perspective, I benefit not at all from my house being worth double, triple, or even quadruple of what I paid for it. It makes no sense to include my condo's value in my net worth. My retirement savings are my stocks and bonds. Including the house value in the net worth appears to be nothing more than a vanity exercise, since it has no impact on my life, which would remain the same whether the condo value doubled or halved. Why should I care? So CMV on this! I'd really like to know why people are so excited when their house increases in value, and why I should be excited as well!",1157,3,994.0,149.96332885075606,901,1167,Q2,Q2,Q2_Q2
t3_eal7a7,"Prostitution should be legal in the states. *Resubmitted due to mod request. *
Hey everyone,
I'm someone who is a genuine advocate for legalizing safe prostitution practices. I will try my best to  the list reasons for why I feel this is the correct way to go about things. I truthfully, honest to god, don’t see why anyone would be against legalizing it. &amp;#x200B;
1. It’s illegal right now, and it still happens. Something must be done to make it a legitimate business. 2. Prostitution is no different then brainless labor work (coal mining)
3. Legalizing prostitution would mean these hotgirls and their ‘corners’ (would be a store prob) would have to meet regulation requirements ie: safer sex for everyone involed. 4. The government collects taxes on all of this, eliminates pimps, number of unwanted baby’s would plummet...
&amp;#x200B;
Think about it. And maybe no more angry incel shootings because they can’t get laid?",930,3,1107.6666666666667,73.0775843424872,1024,1159,Q2,Q3,Q2_Q3
t3_7mxhsy,"Healthcare is a right, not a good, and should be free at the point of use An argument against this is that having too much state provision makes us complacent, stops us from working hard, and takes away incentives to take responsibility for one's own health. However, I believe that healthcare allows people to maintain the basic strength and functionality to be productive and take responsibility for building their own life. Many health problems are not due to lifestyle factors, and we should not deny someone the ability to be a healthy member of society just because they lack the economic means to do so. This actually means we have fewer productive members of society. Many Libertarians believe we should not have such state provisions, as individuals should have low taxes and the right to choose what they do and how they spend their money. However, what if one needs medical care in order to have choices in their life, but they cannot afford it? I hold the same view about most basic state provisions, but using healthcare as an example makes my view easier to explain.",1080,3,1167.3333333333333,93.21659365871152,1060,1228,Q2,Q3,Q2_Q3
t3_bwhb0p,"Carbon Dioxide emissions from transportation vehicles will not decrease until gasoline prices rise significantly Right now, gas is still cheap enough that many car owners in North America do not have a financial incentive to buy electric vehicles, or take public transport more often. People with a small budget would opt to buy second-hand cars, and currently the market for second hand electric vehicles are almost non-existent. As for increasing tax cuts on electric vehicle purchases, the easiest way for the government to fund that would be to increase the carbon tax, which would lead to higher gas prices. Of course, eventually public transportation may become more convenient, or electric vehicles become cheaper, but for now EVs remain a very niche, and somewhat expensive product, while I've seen no trends which indicate a significant improvement of public transportation is underway. It appears to me that you can't have low gas prices and reduce CO2 emissions at the same time.",990,3,1091.3333333333333,102.65151403332214,1008,1206,Q2,Q3,Q2_Q3
t3_pddibd,"Debates are better online because you can’t interrupt someone’s written post A person puts up a table and a sign that says “Pro Life, change my view”. As more people join the conversation, members of the crowd yell “sexist pig”, “my body my rights”, and generally get more aggressive with their heckling. The point of the debate was to truly change a persons mind, but it has now devolved into near physical altercation because two sides can’t agree to let the other side finish their sentences. This scene of debates goes back as old as ancient Greece all the way to modern democratic parliaments. Humans are simply too emotional to put them aside for the sake of truth seeking. Angers rise when words can no longer be found. [Edit]: Thanks guys. What I like about this thread is that it both proved and disproved my argument. I learned a lot via online opinions but I also learned that online makes debates very disjointed and lose interest.",943,3,1298.3333333333333,145.19412292972925,1149,1439,Q2,Q4,Q2_Q4
t3_98lkjz,"Transgenderism is an emotional system, not a biological one For many years, we have accepted the idea of 2 genders. Male, and female. We have used the words sex and gender synonymously. The whole idea of transgenderism is an emotional appeal, where they wish to be another gender, with no obvious biological proofs. Yes, oddities exist. Hermaphrodites and intersex are proof of that, however we've never considered them normal. We've always treated oddities as oddities, not accepted them and even bend society and laws for their sake. It's also a difficult system to adapt to as concepts of misgendering now exist. We now have to be extra careful before approaching someone, or else, if for example in Canada, Bill C-16 makes it a hate crime to misgender if the recipient feels offense, which is also difficult. Concepts like cultural appropriation and micro aggressions exist, and it's difficult to find what's offensive because it's not a set rule state, it's ridiculously subjective. Now I don't call for violence or anything against transgender people. I just don't accept being forced into their system. I would like you all to change my mind in terms of transgenderism.",1176,3,1274.6666666666667,150.646385065601,1168,1447,Q2,Q4,Q2_Q4
t3_p4dk6p,"If a grilled cheese sandwich has anything other than some kind of bread, cheese and butter/mayo/oil, it is no longer a grilled cheese sandwich. I see people all the time call things grilled cheese that aren't and I don't understand it. How the hell is a sandwich with ham, turkey or even brisket a grilled cheese when the primary ingredients are not cheese. Cheese cannot be an after thought or an accent in something something called ""grilled cheese sandwich""  anything other than primary cheese bread and butter/mayo/oil is a sandwich with cheese or some kind of melt. Help me understand this absolute insanity. This is a pretty light hearted CMV and is inspired by the fact that I keep seeing these giant meat filled sandwiches with cheese on them being called things like ""brisket grilled cheese sandwich""  and to me that is a sandwich yes but it shouldn't be called a grilled cheese. Maybe I'm the crazy one but a half pound or pound of meat on bread is just a sandwich even if it has cheese on it.",1003,3,1376.6666666666667,194.76224822417035,1188,1577,Q2,Q4,Q2_Q4
t3_y1i7ki,"We should stop segregating restrooms and just have singular gender-neutral bathrooms in public spaces. I've been thinking about it, and I can't think of a good reason for public restrooms to be segregated by gender or sex. Public restrooms should just have floor-to-ceiling individual stalls for people to use. Such bathrooms would be no more dangerous for sexual assaults than any other public area. No one is actually naked when using the restroom, and having floor-to-ceiling stalls would give everyone complete privacy when doing their ""business."" Basically any argument of this leading to ""women getting raped or crept on by men"" just seems so outdated to me, and seemingly dismisses any possible sexual assaults or predatory behavior against men by other men in the current bathroom setup. Having just one genderneutral bathroom would also protect them. Also think it could raise accountability for people to keep things clean. (\*cough\*specifically talking about men who trash stalls from my own personal experiences\*cough\*)
You can CMV by providing a valid reason to keep having segregated bathrooms in society. **
Sorry, I need to clarify my position because I already changed my original view somewhat. Clearly, if implemented this would cause parts of society to freak out and have a lot of issues/backlash adjusting to it. People have CMV of actually implementing such a system today, however still curious about any real reasons why bathrooms should be segregated, apart from tradition.",1502,3,817.6666666666666,105.85997040115463,727,934,Q3,Q1,Q3_Q1
t3_678y49,"We are not living in a simulation. Elon Musk says that it is most likely that we are living in a simulation. His only way to support it is a philosophical paper written 15 years ago. The paper is all about probability, and it evaluates how out of all possible scenarios for mankind, the most likely is that we end up creating a simulation, and therefore we are most likely in a simulation. There are many problems I find with this:
-“Extraordinary claims require extraordinary evidence.” - Carl Sagan.There is ( to my knowledge ) no scientific evidence to support the claim that we are living in a simulation, something needed in order to make the claim at least slightly believable. -Using probability to reach the conclusion is not enough. Statistically, It is more probable that I, the person that created this post, is chinese (because of the amount of people from a certain country in the world), and yet you do not take it as a fact that I am, nor you take it as a fact that every internet stranger must be chinese. **
-What's the point of being so skeptical about our reality? I see no benefit to questioning our reality to this extent, in which we cannot completely prove, only speculate. * the CMV moderators.",1218,3,682.3333333333334,36.7468819538928,640,706,Q3,Q1,Q3_Q1
t3_ary3eu,"A fresh loaf of bread is always better than packaged bread It mistifies me how people can buy packaged bread. Not only is it more environmentally unfriendly because of the plastic packaging, but packaged bread is just flatout unappealing. &amp;#x200B;
**But packaged bread stays longer fresh that way! **
Bollocks. There are plenty of different ways to keep regular bread fresh. Bread bins, bread sacks other methods. I mean you can even stuff it into one of your disgusting plastic packs if you love them so much. &amp;#x200B;
**But cutting bread is haaaaaaaaaard**
Oh for the love of god. It's not rocket science to saw a straight wodden billet down the middle butterfingers. If you're not an 80-year old quadruple amputee with alzheimers, arthritis and parkinsons you got no reason to not cut your own bread. &amp;#x200B;
**Crumbs! Crumbs everywhere! **
Oh fine. I guess that's a legit reason, but that's such a ridiculous one to switch to this package trash. And even there are ways to mitigate the crumb invasion with special bread cutting boards. &amp;#x200B;
&amp;#x200B;
One factor I'm not really sure about is the price factor, though I guess that might be also different from country to country. &amp;#x200B;",1218,3,767.3333333333334,30.550504633038923,734,794,Q3,Q1,Q3_Q1
