post_id,input,input_length,arg_count,avg_gen_length,std_gen_length,min_gen_length,max_gen_length,input_length_quartile,avg_gen_length_quartile,strata
t3_6kov77,"Human Evolution has Ceased My contention is that Human Evolution has ceased, or has significantly slowed, since the advent of human intelligence. By Evolution, I refer to the currently taught Darwinian Theory of Evolution by Natural Selection. Based on the authoritative definition of Evolution found in Wikipedia:
Evolution is change in the heritable characteristics of biological populations over successive generations. The processes by which the changes occur, from one generation to another, are called evolutionary processes or mechanisms. [26] The four most widely recognised evolutionary processes are natural selection, genetic drift, mutation and gene migration due to genetic admixture. [26] Natural selection and genetic drift sort variation; mutation and gene migration create variation. As taught, Evolution is a natural process in which accidental changes produce both positive and negative adaptations in a species. Those that encourage survival remain and reproduce and those that do not die out. As such it is a natural process occurring over long periods of time. Since the advent of human intelligence, humanity has been selectively breeding both itself, the animals it eats and domesticates, and the plants that it harvests and eats. Thus, conducting a form of directed Genetic Engineering through natural processes (a form of GMO). Changes to these human, animal and plant species can thus be thought of in terms of Intelligent Design rather than Evolution. The term Human Controlled Evolution, used by many scientists who should know better, may be inherently correct, but an incorrect usage of terminology. Change my view. * the CMV moderators.",1668,3,1221.0,261.47083967433156,980,1499,Q4,Q4,Q4_Q4
t3_8gmxsf,"Social justice is making racial segregation worse, not better. Social justice warriors \(SJWs\) more frequently tell other people ""you must do X because you're race Y"" or ""you can't do X because you're race Y"" so much. For example:
""You can't disagree with people of color about racism because you're white""
""You can't wear a Chinese dress to prom because you're white"" \(yes, this post is about that issue\)
""If you're asian you must be offended by white people having asian fetishes""
""You must wear an afro because you're black, otherwise you're trying to be white"" \(example\)
""You can't marry white people if you're black"" \(example\)
If we want equality we need to stop this kind of thinking. racial equality means that everyone, regardless of race, should be equally allowed to discuss racial issues, equally allowed to wear chinese dresses, equally allowed to love whoever they want, equally allowed to cosplay any character, equally allowed to marry anyone regardless of race. The social justice movement, on the other hand, does the exact opposite. They impose boundaries and limitations on what people are allowed to do based on their race. This is not fair, and cannot be allowed if we want to strive for equality. To limit what people can do because of their race makes them feel alienated and not welcome. This deepens racial divides. To change my view, there is one thing you need to do: Give one example of when modern \(post\-2010\) social justice activism has decreased the amount of segregation \- where a certain race was previously not allowed to do something because of their race, but through social justice activism, are now allowed to do. This is not the only way to change my view, but it is my best suggestion for you.",1744,3,1975.0,218.6869909253863,1787,2215,Q4,Q4,Q4_Q4
t3_pcawwd,"social media are ruining my generation I'm a 20 years old male and I think social media are more bad than good for my generation, hear me out. They don't teach inclusivity cause several races are left out from the equation and also thinner/normal body types. They help glorify sex work  in an ill way and encourage it, which is degrading and has several mental effect on women and men of all ages. They push women to be slutty to feel empowered confusing the two concepts and push men to be too masculine and to view women as objects and to not respect them. Also don't get me started on the body dysmorphia. Also reaserch show that seeing your friends always posting their best self on social media and comparing yourself to them makes u depressed and unsatisfied with your life, and no, the ""remember social media is fake"" trend is like pissing into a fire  trying to estinguish it, it does t solve the problem. the only thing they're good is to keep in touch with poeple but the posting part is totally useless and it's just a way to get validation for a generation that is willing to do the dumbest shit to get it. Also tik tok should be canceled. It is basically a p*do/horny guys/creeps dream come true where they can see underage girls dressing and acting in revealing ""clothes ""  desperate for likes but they don't know where they come from. Also it is a Chinese company that doesn't give a shut about your privacy just saying... They are also the worst source to get information from cause 90 percent of the time reaserch and statistics is manipulated or not cited(like this post lol) and fake news are spread like crazy 
Hope someone will change my point of view since I have the sin to still using them daily and I need to feel good about myself even tho we all know  these things.",1792,3,1653.6666666666667,272.018994434825,1478,1967,Q4,Q4,Q4_Q4
t3_69p4a2,"I believe that kids should be able to take an off year (5-12 grade)if they feel they need a break. Lots of kids, especially in high school are often stressed with everything going on in their lives. I can speak from experience that having social issues, school work and sports can all be a big weight in the life of a 14-18 year old. I believe that if a kid needs they should be able to take an off year and relax instead of having to deal with all of this stress at once with no break or time to calm down. While it should be regulated to 1 or 2 years per kid, I think it would make a huge difference in the stress levels of teenagers. It would also lower the percent of kids with anxiety and help with school work, as the kids will be able to actually learn the information instead of being overpowered with schoolwork, and having no downtime to actually soak in what they have learned. 25% of teens have some sort of anxiety. It is also shown in college student athletes that taking a gap year between high school and college actually lowers anxiety as well as the risk for burnout. Burnout is what occurs when somebody does an activitely so much and so actively that they start to see that activity as a burden on them and can start to develop depression and lethargy. Burnout is something that affects many people, especially student athletes and giving kids the ability to take a year off might help eliminate this problem easier. The only problem I see is that a kid might use both of their years in a row just to abuse it and then when they actually need to take a break they don't have the years to use and suffer from anxiety",1635,3,1045.6666666666667,119.73860418984903,919,1157,Q4,Q3,Q4_Q3
t3_98k1to,"Humanity is a disease and despite the hopes of religions, philosophies, ways of living etc. We aren't gonna get any better. Colour this to my mental health, view of self, onset of nihilism or just general pessimistic view on life but the more I'm learning about the world, people and society in general the more I can't stand it. Now I know there's gonna be some comedic geniuses that will say ""you sound like a university fresher who's just found Schopenhauer""/""fuck off newfag"" but I'm genuinely struggling to see it. There are pockets of beauty within humanity I don't doubt that for a second, nature and wildlife are breathtaking. But the fact they are so few and far between in the grand scheme of fuckery that is going on astounds me how we're all keeping it together and not going all out anarchy. FMG, Slavery (actual and the prison industrial complex), ethnic cleansing, labour camps, corruption, sexual abuse, all our ""heroes"" being utter scumbags, a burgeoning mental health crisis throughout the world, organ harvesting, people still believing in 2000 year old myths and using them for whatever fucked up agenda they have (yes I do realise religion can be a force for good, get outta here r/atheism), deeply flawed political systems, social media, celebrities who have not a lick of merit or usefulness in the world other than to generate paper with ""important people on them"". Lord God I could go on for years. Someone please give me a coherent reason as to why we self-aware apes shouldn't follow ol' Rust Cohle's advice and walk into a collective oblivion gracefully. Other than our inherent biological drive for survival and self-preservation why are we persisting to breed? Someone for the love of Jah change my infantile, ungrateful view.",1756,3,819.0,23.259406699226016,798,844,Q4,Q1,Q4_Q1
t3_xuu099,"YouTube is doing all they can Every couple of weeks, some creator blows up with a horror story of how their channel was deleted for no reason, how the algorithm is racist, how their content was claimed by bad actors, etc. These are obviously issues with underlying causes, but the call always falls to YouTube to fix their platform. I'm here to say, it's not feasibly possible for YouTube to fix their platform. There are millions of YEARS worth of continuous video on YouTube. 500 hours of content are uploaded every minute. People are being absolutely delusional if they assume humans are manually dealing with any of that data on the backend in any but the most extreme circumstances. Realistically, 99.9999...% of the process is automated. And there are no other solutions unless you want to hook the entire population of Norway up to Clockwork Orange rigs for a few years. Does the system give false positives and remove innocent videos? Yes. But it's hard to argue for innocent until proven guilty when bad actors try to teach toddlers to kill themselves
 
Does the algorithm bias against certain demographics? Almost certainly. But that's not a secret racist cabal of YouTube Execs deciding that. It's machine learning. If the algorithm learns to be racist, it's because the viewers were consciously or unconsciously biased towards those results. So why doesn't YouTube just ""fix"" the algorithm and the bots? Well, interestingly, it's because machine learning has outpaced human understanding. There is no nerd squad that can just open up the hood and turn off the racism line of code. Modern bots are made using the Monkeys with Typewiters method. Yes, YouTube has a lot of problems, but those problems are largely societal. And honestly, until Skynet comes out, I think it would be easier to fix society than try to reign in an ocean of data by yelling at it.",1868,3,1508.0,49.78955713801841,1453,1550,Q4,Q4,Q4_Q4
t3_251sp2,"Deliberately increasing your caloric intake to add muscle (""bulking"") leads to obesity later in life. The idea is that deliberately overeating will build eating habits that will be difficult to change later, when you are working a desk job and being a dad and not burning off those calories. This would not apply to celebrities whose job includes shaping their bodies and people with sufficient self-control that they are never tempted to keep eating the slab of ribs until they're gone. But it happens to former football players all the time. One premise I have that you might not share is that losing weight is just about impossible once you have gained it. There is no scientifically approved diet that you can follow and it will work. This is why any weight gain that disrupts a body with a nice, working non-obese equilibrium is very risky. In sum: like tanning, bulking is something that increases your relative status but is bad for your body in the long run.",966,3,1063.3333333333333,18.876793513023667,1047,1084,Q2,Q3,Q2_Q3
t3_acw4be,"Claiming that 'men are trash' is counter productive to gender equality I am not saying in general men don't commit more crimes. I just think lumping all men together like this is unnecessarily negative and actually holds society back. If you want, read this argument I just had and ignore the terrible grammar: 
What do you think we should reconsider about our views? All I want is to compromise here but not if it means believing in hate speach spread by word of mouth. Does anyone know of any good unbiased articles regarding this matter? Any well thought out opinions would be also helpful. Edit: I have updated some of my comments to give deltas and fully reflect what I know believe. I in no way completely altered what claim I was originally making. It was difficult for me to patronize a seemingly overly negative stance when unbiased points about the matter were not also brought to my attention. This does not mean I do not feel the desire to correct some of the bias opinions I held as well, or may still hold. Making this post has allowed me to better structure my beliefs on the matter in a way that more appropriately sympathizes for woman who still have to fight for equality in many ways. I am very grateful we share the right to express ourselves aggressively as we see fit, yet I will not fully support phrases which insult others for the sake of bringing attention to the matter. It is not an entirely counter productive way of creating change but I still see it as a flawed method which can easily divide people when the true goal is the opposite.",1566,3,1499.3333333333333,135.69205331681488,1396,1653,Q4,Q4,Q4_Q4
t3_28sivx,"I see no reason why men's and women's chess are separate events. Sure, sex segregation makes a lot of sense for many sports/games where men might have an advantage due to physiological differences. But chess is purely mental. There is no need for strength, speed, endurance or any other physiological parameter that would give men an advantage. In fact, some women do compete successfully in top flight tournaments with men, something that would be impossible in physical sports. If anything, it seems that ""women only"" chess events are sexist, because the implication is that women are not as smart as men. Edit:
The totality of several posts convinced me that women only events maybe needed *for now* as a kind of a remedial measure for countering many years of men dominance in chess and the fact that currently women are underrepresented in chess. However, I still believe that an *eventual* goal should be complete sex equality in chess tournaments.",954,3,879.3333333333334,120.3841074782437,743,971,Q2,Q1,Q2_Q1
